no_entidade,ds_endereco,nu_endereco,no_bairro,co_cep,sg_uf,no_municipio,nu_ddd,nu_telefone
COLEGIO E CURSO PENSI - RECREIO I,AVENIDA DAS AMERICAS,15403,RECREIO DOS BANDEIRANTES,22790701,RJ,Rio de Janeiro,21,24329651
SISTEMA ELITE DE ENSINO,RUA NACIONAL,160,TAQUARA,22710092,RJ,Rio de Janeiro,21,31721339
COLEGIO E CURSO APLICACAO,RUA APIACAS,321,TAQUARA,22730190,RJ,Rio de Janeiro,21,24233613
COLEGIO PH,RUA ALBANO DE CARVALHO,48,RECREIO DOS BANDEIRANTES,22795380,RJ,Rio de Janeiro,21,34111013
ESCOLA ELEVA,RUA GENERAL SEVERIANO,159,BOTAFOGO,22290040,RJ,Rio de Janeiro,21,40422492
COLEGIO E CURSO SAMARITANO,RUA ABAETE,283,BANGU,21810130,RJ,Rio de Janeiro,21,41210665
COLEGIO E CURSO MATRIZ EDUCACAO,RUA PADRE VENTURA,200,TAQUARA,22710266,RJ,Rio de Janeiro,21,32588009
COLEGIO E CURSO PIRAQUARA,RUA PIRAQUARA,79,REALENGO,21755270,RJ,Rio de Janeiro,21,24020256
CENTRO EDUCACIONAL DAS AMERICAS,RUA ALBERTO CAVALCANTI,64,RECREIO DOS BANDEIRANTES,22790850,RJ,Rio de Janeiro,21,35566620
COLEGIO FUTURO VIP - JARDIM AMERICA,RUA RICHARD STRAUSS,52,JARDIM AMERICA,21240110,RJ,Rio de Janeiro,21,37954068
COLEGIO LAURA MATOS UNIDADE 2,RUA DO GOVERNO,357,REALENGO,21770100,RJ,Rio de Janeiro,21,33379732
CEI INDIR BALTAZAR SANTANA,JOSE CARLOS MASTROMONICO,189,JARDIM PLANALTO,8040440,SP,São Paulo,11,27294258
CR P CONV DIAMANTES,CAETANO PINTO,188,BRAS,3041000,SP,São Paulo,11,32072028
ESC PART BERCARIO CONCEITO,ITAGUABA,208,SANTA CECILIA,1233050,SP,São Paulo,11,36620665
CR P CONV EBENEZER,DO HIPODROMO,555,BRAS,3051900,SP,São Paulo,11,27964336
ESC PART BRINCARTE B R I,PEIXOTO GOMIDE,1596,JARDIM PAULISTA,1409002,SP,São Paulo,11,30609013
CENTRO DE ENSINO GRAU TECNICO UNIDADE BRAS,CELSO GARCIA,278,BRAS,3014000,SP,São Paulo,11,22912352
CR P CONV RAIO DE SOL,DOUTOR FREDERICO MARTINS DA COSTA CARVALHO,475,JARDIM PLANALTO,3984140,SP,São Paulo,11,27019655
CONDE DOMINGOS COLEGIO,ARTUR MENDONCA,200,TATUAPE,3067040,SP,São Paulo,.,.
SAO FRANCISCO DE ASSIS COLEGIO,EUCLIDES PACHECO,478,VILA GOMES CARDIM,3321000,SP,São Paulo,11,22274310
COLEGIO SANTA AMALIA MAPLE BEAR ENSINO BILINGUE,RUA PROFESSOR PEDREIRA DE FREITAS,981,TATUAPE,3312052,SP,São Paulo,11,23224050
ESPIRITO SANTO COLEGIO,TUIUTI,1442,TATUAPE,3081012,SP,São Paulo,11,33891000
SANTO ANTONIO DE LISBOA COLEGIO,RUA FRANCISCO MARENGO,1317,TATUAPE,3313001,SP,São Paulo,11,29424300
EQUIPE COLEGIO,RUA SAO VICENTE DE PAULA,374,SANTA CECILIA,1229010,SP,São Paulo,11,35799150
COLEGIO ASSUNCAO,LORENA,665,JARDIM PAULISTA,1424000,SP,São Paulo,11,38873433
DANTE ALIGHIERI COLEGIO,JAU,1061,JARDIM PAULISTA,1420001,SP,São Paulo,11,31794400
SAO LUIS COLEGIO EIFM,DOUTOR DANTE PAZZANESE,295,VILA MARIANA,4012180,SP,São Paulo,11,31389600
COLEGIO MADRE ALIX,GABRIEL MONTEIRO DA SILVA,1555,JARDIM AMERICA,1441001,SP,São Paulo,11,30828455
COLEGIO MATER DEI,RUA MARECHAL BITTENCOURT,62,JARDIM AMERICA,1432020,SP,São Paulo,11,38870400
BANDEIRANTES COLEGIO EFM,ESTELA,268,VILA MARIANA,4011001,SP,São Paulo,11,50873500
BENJAMIN CONSTANT COLEGIO,RUA ECA DE QUEIROZ,75,VILA MARIANA,4011030,SP,São Paulo,11,50808177
FRIBURGO COLEGIO,JOAO DIAS,242,SANTO AMARO,4724000,SP,São Paulo,11,55235633
BEATISSIMA VIRGEM MARIA INSTITUTO DE EDUCACAO,MORUMBI,8652,SANTO AMARO,4703002,SP,São Paulo,11,55428700
CARNEIRO RIBEIRO PROF COLEGIO,AFONSO MARIANO FAGUNDES,945,SAUDE,4054001,SP,São Paulo,11,22755727
SESI 111 CENTRO EDUCACIONAL,RUA BOM PASTOR,654,IPIRANGA,4203000,SP,São Paulo,11,20650142
SAO FRANCISCO XAVIER COLEGIO,MOREIRA E COSTA,531,IPIRANGA,4266010,SP,São Paulo,11,30130335
ARQUIDIOCESANO DE SAO PAULO COLEGIO MARISTA,RUA DOMINGOS DE MORAES,2565,VILA MARIANA,4035000,SP,São Paulo,11,50818518
NOSSA SENHORA DO ROSARIO COLEGIO,DOMINGOS DE MORAIS,2958,VILA MARIANA,4036100,SP,São Paulo,11,55895444
COLEGIO GALVAO UNIDADE II,AVENIDA PIRES DO RIO,1127,SAO MIGUEL PAULISTA,8020000,SP,São Paulo,11,24780610
NOVO HORIZONTE COLEGIO,RUA PEDRO SOARES DE ANDRADE,254,SAO MIGUEL PAULISTA,8021040,SP,São Paulo,11,22974415
PASCHOAL DANTAS COLEGIO,AVENIDA PIRES DO RIO,2801,SAO MIGUEL PAULISTA,8041000,SP,São Paulo,11,20551400
REDE DECISAO UNIDADE SAUDE,GUATAS,281,SAUDE,4053040,SP,São Paulo,11,25786435
ESC PART UNIVERSO KIDS E E I,FAVEIRA DO MATO,886,JARDIM PLANALTO,8040370,SP,São Paulo,11,20527425
FRANCISCO MATARAZZO ESCOLA SENAI,CORREIA DE ANDRADE,232,BRAS,3008020,SP,São Paulo,11,33123555
CARLITOS ESCOLA UNIDADE I,BROTERO CONSELHEIRO,832,SANTA CECILIA,1232010,SP,São Paulo,11,36629591
LUMIERE COLEGIO,EMILIO MALLET,651,VILA GOMES CARDIM,3320000,SP,São Paulo,11,37914809
CENTRO INTERESCOLAR OBJETIVO UNIDADE TATUAPE,AZEVEDO SOARES,1540,VILA GOMES CARDIM,3322001,SP,São Paulo,11,29415249
ETAPA COLEGIO DE EFM,VERGUEIRO,1987,VILA MARIANA,4101000,SP,São Paulo,11,21871010
BRITANICA DE SAO PAULO ESCOLA ST PAUL S SCHOOL,JUQUIA,166,JARDIM AMERICA,1440020,SP,São Paulo,11,30873399
CHAPEL SCHOOL,JOAO DE PONTES VIGARIO,537,SANTO AMARO,4748000,SP,São Paulo,11,21017400
AGOSTINIANO MENDEL COLEGIO,ESTEVAO PERNET PADRE,620,VILA GOMES CARDIM,3315000,SP,São Paulo,11,20903266
REDE DECISAO UNIDADE POP,ALEIXO MONTEIRO MAFRA PADRE,18,SAO MIGUEL PAULISTA,8011010,SP,São Paulo,11,42103724
ADVENTISTA SAO MIGUEL PAULISTA EEIFM,AVENIDA ROSALIA,270,SAO MIGUEL PAULISTA,8021070,SP,São Paulo,11,97453721
ESC PART KOALA E E I,JOSE MARIA LISBOA,568,JARDIM PAULISTA,1423000,SP,São Paulo,11,30522911
CIDADE JARDIM ESCOLA,AMERICO DE MOURA PROFESSOR,101,CIDADE JARDIM,5670060,SP,São Paulo,11,38129122
COLEGIO PARALELO,LUIS BARROSO CORONEL,390,SANTO AMARO,4750030,SP,São Paulo,11,31862300
CARLOS DRUMMOND DE ANDRADE COLEGIO,RUA PROFESSOR PEDREIRA DE FREITAS,401,TATUAPE,3312052,SP,São Paulo,11,29421488
ROBERTO SIMONSEN ESCOLA SENAI,RUA MONSENHOR ANDRADE,298,BRAS,3008000,SP,São Paulo,11,33225000
CAVLAC COLEGIO,RUA PEDROSO DA SILVA,482,SAO MIGUEL PAULISTA,8080040,SP,São Paulo,11,25810528
RUMO INICIAL COLEGIO,LAGRIMAS,2282,IPIRANGA,4232000,SP,São Paulo,11,29476697
SAAB COLEGIO,JACIRENDI,328,TATUAPE,3080000,SP,São Paulo,11,20939893
ESPERANTO COLEGIO,VIRGINIA SANTA,419,TATUAPE,3084000,SP,São Paulo,11,22963429
LA FONTAINE COLEGIO,RUA AZEVEDO SOARES,318,VILA GOMES CARDIM,3322000,SP,São Paulo,.,.
CR P CONV SAO VITO,POLIGNANO A MARE,255,BRAS,3005040,SP,São Paulo,11,32278234
CEI INDIR CORACAO DE MARIA,CONSELHEIRO BROTERO,779,SANTA CECILIA,1232011,SP,São Paulo,11,36631368
CELIA HELENA TEATRO ESCOLA,GABRIEL SAO,462,JARDIM PAULISTA,1435000,SP,São Paulo,11,38848294
INSTITUTO MONITOR LTDA,AV. RANGEL PESTANA,1.105,BRAS,3001000,SP,São Paulo,11,35551000
EBRAE - ESCOLA BRASILEIRA DE ENSINO A DISTANCIA,RUA PAMPLONA,1200,JARDIM PAULISTA,1405906,SP,São Paulo,11,38895899
CEI INDIR MARIA ARMINDA NOGUEIRA IRMA,JUVENAL GOMES COIMBRA,64,BRAS,3021050,SP,São Paulo,11,22911747
CEI INDIR CANTINHO DO BRYAN,PEIXOTO GOMIDE,305,JARDIM PAULISTA,1409001,SP,São Paulo,11,31594950
ACADEMIA INTERNACIONAL DE CINEMA,GABRIEL DOS SANTOS,142,SANTA CECILIA,1231010,SP,São Paulo,11,36607883
SESI 434 CENTRO EDUCACIONAL,SERRA DE BRAGANCA,990,VILA GOMES CARDIM,3318000,SP,São Paulo,11,20952372
OBJETIVO CENTRO INTERESCOLAR UNIDADE IPIRANGA,MARCHETTI PADRE,235,IPIRANGA,4266000,SP,São Paulo,11,22191168
FENIX UNIDADE III COLEGIO,MARIO RODRIGUES FON,44,SAO MIGUEL PAULISTA,8011280,SP,São Paulo,11,20372351
INSTITUTO BRASILEIRO DE DESIGN DE INTERIORES IBDI,AV RANGEL PESTANA,1105,BRAS,3001000,SP,São Paulo,11,32298552
CR P CONV PINOCCHIO III,MARTIM FRANCISCO,53,SANTA CECILIA,1226001,SP,São Paulo,11,23056463
ESC PART RENASCER COLEGIO,TORRES FLORENCIO E RIELLI,215,JARDIM PLANALTO,3984050,SP,São Paulo,11,27036891
COLEGIO SOKA DO BRASIL,DO CURSINO,362,SAUDE,4132000,SP,São Paulo,11,50603306
LICEU PASTEUR UNIDADE VERGUEIRO,VERGUEIRO,3799,VILA MARIANA,4101300,SP,São Paulo,11,59047822
AMORIM COLEGIO,RUA CANTAGALO,339,TATUAPE,3319000,SP,São Paulo,11,22939166
COLEGIO MARISTA ANJO DA GUARDA EI EF EM,RUA JOSE VALLE,751,SANTA FELICIDADE,82020250,PR,Curitiba,41,32220999
ESCOLA BANDEIRANTES EDUCACAO INFANTIL E ENSINO FUNDAMENTAL,RUA CUIABA,1284,CAJURU,82930010,PR,Curitiba,41,32660881
COLEGIO BOM JESUS ED INFANTIL ENSINO FUNDAMENTAL E MEDIO SEDE,RUA 24 DE MAIO,135,CENTRO,80230080,PR,Curitiba,41,21054000
CENTRO DE EDUCACAO INFANTIL CEU AZUL,RUA SARGENTO ALPENDRE,42,BACACHERI,82515120,PR,Curitiba,41,33285269
CENTRO DE EDUCACAO INFANTIL SAO JOAO BATISTA,RUA PIQUIRI,326,REBOUCAS,80230140,PR,Curitiba,41,33338373
COLEGIO ERASTO GAERTNER,RUA PASTOR DAVID KOOP,189,BOQUEIRAO,81670340,PR,Curitiba,41,33764566
COLEGIO EXPOENTE BOA VISTA - EDUCACAO INFANTIL ENSINO FUNDAMENTAL E MEDIO,RUA CARLOS DE CAMPOS,1090,BOA VISTA,82560430,PR,Curitiba,41,35266425
COLEGIO ADVENTISTA BOQUEIRAO - EIEFEM,RUA CLETO DA SILVA,1128,BOQUEIRAO,81670450,PR,Curitiba,41,30518550
COLEGIO IMACULADA CONCEICAO,AVENIDA MANOEL RIBAS,6318,SANTA FELICIDADE,82400000,PR,Curitiba,41,30911400
COLEGIO INTERNACIONAL DE CURITIBA - EDUCACAO INFANTIL ENSINO FUNDAMENTAL E MEDIO,AVENIDA DOUTOR EUGENIO BERTOLLI,3900,SANTA FELICIDADE,82410530,PR,Curitiba,41,35257400
JOAO BAGOZZI COL PE - EF-EM E NORMAL,RUA JOAO BETTEGA,15,PORTAO,81070000,PR,Curitiba,41,30262144
COLEGIO NOSSA SENHORA DE SION-SOLITUDE- EIEFEM,RODOVIA BR-277 CURITIBA-PARANAGUA,4761,CAJURU,82970025,PR,Curitiba,41,32266161
COLEGIO MODELO CURITIBA EIRELI,RUA ENGENHEIRO BENEDITO MARIO DA SILVA,95,CAJURU,82970000,PR,Curitiba,41,30200501
ASSEIJ COLEGIO NOSSA SENHORA DO ROSARIO,RUA EDUARDO GERONASSO,1266,BACACHERI,82510280,PR,Curitiba,41,32564543
ESCOLA NOSSA SENHORA DA ESPERANCA,RUA AQUELINO ORESTES BAGLIOLI,155,PRADO VELHO,80215434,PR,Curitiba,41,33630033
COLEGIO NOSSA SENHORA MEDIANEIRA,AV. JOSE RICHA,10.546,PRADO VELHO,81690100,PR,Curitiba,41,32188000
BOM JESUS SEMINARIO,NOSSA SENHORA APARECIDA,1468,SEMINARIO,80310100,PR,Curitiba,41,32741228
COLEGIO MARISTA PARANAENSE EI EF EM,RUA BISPO DOM JOSE,2674,SEMINARIO,80440080,PR,Curitiba,41,30162552
COLEGIO ADVENTISTA PORTAO - EIEFM,RUA FREI GASPAR DA MADRE DE DEUS,707,PORTAO,81070090,PR,Curitiba,41,30518680
COLEGIO SAGRADO CORACAO DE JESUS,AVENIDA IGUACU,1550,REBOUCAS,80250190,PR,Curitiba,41,31129300
COLEGIO MARISTA SANTA MARIA EI EF EM,RUA PROFESSOR JOAQUIM DE MATOS BARRETO,98,SAO LOURENCO,82200210,PR,Curitiba,41,30742500
LUMEN EDUCACAO INFANTIL E ENSINO FUNDAMENTAL,RUA JOSE NAVES DA CUNHA,348,SEMINARIO,80310080,PR,Curitiba,41,32748888
COLEGIO DO BOSQUE MANANCIAIS,RUA JOSE KORMANN,940,SAO LOURENCO,82200440,PR,Curitiba,41,33524678
CENTRO DE EDUCACAO BASICA PARA JOVENS E ADULTOS A DISTANCIA MATHISA - EF E EM,RUA RENASCENCA,30,SANTA FELICIDADE,82410110,PR,Curitiba,41,33640493
CENTRO DE EDUCACAO INFANTIL AQUARELA LTDA,AVENIDA ANITA GARIBALDI,4374,SAO LOURENCO,82210000,PR,Curitiba,41,30454111
ACESSO SANTA FELICIDADE,AV VEREADOR TOALDO TULIO,1930,SANTA FELICIDADE,82320010,PR,Curitiba,.,.
CENTRO EDUC PROFIS MACHADO DE ASSIS - FAMA,FLAVIO DALLEGRAVE,4390,BACACHERI,80045250,PR,Curitiba,41,30490440
EDUCACAO INFANTIL COMECAR BEM,RUA NOSSA SENHORA CONSOLADA,05,SANTA FELICIDADE,82030190,PR,Curitiba,41,33643499
COLEGIO SABER - EM,RUA ALFERES POLI,1982,REBOUCAS,80220050,PR,Curitiba,41,33223474
UEPT 46 - UNIDADE DE EDUCACAO PRO E TECNOLOGICA DE CURITIBA PORTAO- SENAC,RUA CALIXTO RAZOLINI,215,PORTAO,81070060,PR,Curitiba,41,33145850
CENTRO DE EDUCACAO PROFISSIONAL EXITUM,AVENIDA IGUACU,754,REBOUCAS,80230020,PR,Curitiba,41,30775757
CENTRO DE ENSINO GRAU TECNICO CURITIBA,AVENIDA SETE DE SETEMBRO,3293,REBOUCAS,80230010,PR,Curitiba,41,30183020
VILA MILITAR COLEGIO,RUA ALMIRANTE GONCALVES,1423,REBOUCAS,80230060,PR,Curitiba,41,31482830
CENTRO DE EDUCACAO INFANTIL COMECANDO FELIZ,RUA SATURNINO MIRANDA,630,SANTA FELICIDADE,82030320,PR,Curitiba,41,33728926
CEI PRIMEIROS PASSOS,RUA MANOEL RIBAS,6951,SANTA FELICIDADE,82400000,PR,Curitiba,41,30720302
PRIMEIRA OPCAO CEI,RUA MATEUS LEME,5422,SAO LOURENCO,82130162,PR,Curitiba,.,.
CENTRO DE EDUCACAO INFANTIL CANTINHO DO PARQUE,RUA RODRIGO DE FREITAS,580,BACACHERI,82515350,PR,Curitiba,41,30278048
CENTRO DE EDUCACAO INFANTIL VICENTINO SANTA LUISA,RUA EMBAIXADOR HIPOLITO DE ARAUJO,203,REBOUCAS,80215050,PR,Curitiba,41,33343142
LUAN MULLER E EI EF MOD ED ESP,RUA PROFESSOR JOAO ARGEMIRO LOYOLA,220,SEMINARIO,80240530,PR,Curitiba,41,32449166
COLEGIO ADVENTISTA CENTENARIO - EIEFM,RUA ARGELIA,85,CAJURU,82960200,PR,Curitiba,41,32263636
RENASCER E EI EF MOD ED ESP,RUA IMACULADA CONCEICAO,983,PRADO VELHO,80215030,PR,Curitiba,41,30292832
PODIUM E EI EF,RUA VICENTE DE CARVALHO,203,CAJURU,82940370,PR,Curitiba,41,33592566
COLEGIO ENSITEC - ENSINO FUNDAMENTAL MEDIO E PROFISSIONAL,RUA ANTONIO PIETRUZA,45,PORTAO,80610320,PR,Curitiba,41,30914500
MARISA AMADA P SELLA E EI EF MOD ED ESP,RUA IMACULADA CONCEICAO,935,PRADO VELHO,80215030,PR,Curitiba,41,33332583
ESCOLA BAMBINATAEDUCACAO INFANTIL E ENSINO FUNDAM,RUA DOUTOR LEAO MOCELLIN,328,SANTA FELICIDADE,82030230,PR,Curitiba,41,32973933
ESCOLA TECNICA PROFISSIONAL LTDA,RUA ENGENHEIROS REBOUCAS,2213,REBOUCAS,80230040,PR,Curitiba,41,33327025
COLEGIO IRMAO MARIO CRISTOVAO - TECPUC - ENSINO MEDIO E PROFISSIONAL,RUA IMACULADA CONCEICAO,1155,PRADO VELHO,80215901,PR,Curitiba,41,32711395
ASSISBAN,RUA TENENTE JOSE RIBAS KENDRICK,03,CAJURU,82970310,PR,Curitiba,41,32264242
CEI MARIA JOSE COUTINHO CAMARGO,RUA RODRIGO OCTAVIO DE LANGAARD MENEZES FILHO,118,SAO LOURENCO,82200200,PR,Curitiba,41,32003600
CENTRO EDUCACIONAL MARISTA IRMA EUNICE BENATO,RUA IMACULADA CONCEICAO,1155,PRADO VELHO,80215901,PR,Curitiba,41,32711313
ALTO PADRAO COLEGIO ED INF E ENS FUND E MED,RUA SANTO ANDRE,121,CAJURU,82900300,PR,Curitiba,41,32676800
ACESSO BOQUEIRAO,AV MAL FLORIANO PEIXOTO,7780,BOQUEIRAO,81650000,PR,Curitiba,.,.
CEBEC E EI EF,RUA NILO PECANHA,3500,SAO LOURENCO,82120440,PR,Curitiba,41,32537958
INST EDUC INF BILINGUE UP KIDS SCHOOL,ALAMEDA EMILIO DE MENEZES,100,TRES FIGUEIRAS,91340360,RS,Porto Alegre,51,33287118
5210 IEI EREMI,R PAULINO AZURENHA,445,PARTENON,90680240,RS,Porto Alegre,51,33526705
SENAC RIO GRANDE DO SUL,AV. ALBERTO BINS,665,CENTRO HISTORICO,90030142,RS,Porto Alegre,51,32142997
5236 EEI PITINGUINHA,R WALTHER SCHNEIDER,224,RESTINGA,91790402,RS,Porto Alegre,51,32036570
5233 ECEI PROFESSORA VIVI REIS,R CAPITAO PEDROSO,540,RESTINGA,91790790,RS,Porto Alegre,51,32662058
5235 EEI EDUARDA PUJOL ZANIRATTI II,R ELZIRA NUNES DA SILVA,100,RESTINGA,91788712,RS,Porto Alegre,51,32482033
COLEGIO ANCHIETA,AV. NILO PECANHA,1521,TRES FIGUEIRAS,91330000,RS,Porto Alegre,51,33826000
COLEGIO MARISTA CHAMPAGNAT,AVENIDA BENTO GONCALVES,4314,PARTENON,90650001,RS,Porto Alegre,51,33206200
COLEGIO FARROUPILHA,RUA CARLOS HUBER,425,TRES FIGUEIRAS,91330150,RS,Porto Alegre,51,34551805
COL NOSSA SENHORA DO BOM CONSELHO,RUA RAMIRO BARCELOS,996,FLORESTA,90035001,RS,Porto Alegre,51,33110522
COLEGIO LA SALLE DORES,RUA RIACHUELO,800,CENTRO HISTORICO,90010272,RS,Porto Alegre,51,32139600
COLEGIO MARISTA SAO PEDRO,RUA ALVARO CHAVES,625,FLORESTA,90220040,RS,Porto Alegre,51,32908500
6001 EEF PEQUENA CASA DA CRIANCA,R MARIO DE ARTAGAO,13,PARTENON,90680090,RS,Porto Alegre,51,30760500
ESC ADVENTISTA DE ENSINO FUNDAMENTAL DE SARANDI,RUA PASSOS FIGUEIROA,841,SARANDI,91110500,RS,Porto Alegre,51,33647979
COL ADVENTISTA MARECHAL RONDON,RUA MALI,255,VILA IPIRANGA,91370230,RS,Porto Alegre,51,33496600
COLEGIO SINODAL DO SALVADOR,AVENIDA MATHILDE TREIN RENNER,55,VILA IPIRANGA,91370050,RS,Porto Alegre,51,33405509
COL SANTA DOROTEIA,RUA MALI,405,VILA IPIRANGA,91370230,RS,Porto Alegre,51,33407908
COLEGIO SALESIANO DOM BOSCO,RUA DOUTOR EDUARDO CHARTIER,360,PASSO DA AREIA,90520100,RS,Porto Alegre,51,33379833
ESC DE EDUC BASICA DON LUIS GUANELLA,AVENIDA BENNO MENTZ,1560,VILA IPIRANGA,91370020,RS,Porto Alegre,51,33489733
COLEGIO LUTERANO DA PAZ,AVENIDA ALCIDES S. SEVERIANO,100,SARANDI,91130500,RS,Porto Alegre,51,33644908
COL KENNEDY,AV ALCIDES SEVERIANO,99,SARANDI,91130500,RS,Porto Alegre,51,33641142
INSTITUTO SAO FRANCISCO PALLOTTI,RUA TUPI,212,PASSO DA AREIA,91030520,RS,Porto Alegre,51,33413055
COLEGIO ADVENTISTA DO PARTENON,AVENIDA VALADO,363,PARTENON,91510740,RS,Porto Alegre,51,33392020
INSTITUTO DE EDUCACAO SAO FRANCISCO,AVENIDA BALTAZAR DE OLIVEIRA GARCIA,4879,RUBEM BERTA,91180001,RS,Porto Alegre,51,32723800
COLEGIO ACM CENTRO,RUA WASHINGTON LUIZ,1050,CENTRO HISTORICO,90010460,RS,Porto Alegre,51,32136000
COL MARISTA NOSSA SENHORA DO ROSARIO,PRACA DOM SEBASTIAO,02,INDEPENDENCIA,90035080,RS,Porto Alegre,51,32841200
COLEGIO PROVINCIA DE SAO PEDRO,AVENIDA MARECHAL ANDREA,345,BOA VISTA,91340400,RS,Porto Alegre,51,33282810
ASSOC BENEFIC SANTA ZITA DE LUCCA,RUA BATISTA XAVIER,600,PARTENON,90680120,RS,Porto Alegre,51,33361880
COL MONTEIRO LOBATO - ESC EDUC BASICA,RUA SALOMAO DUBIN,200,BOA VISTA,91340450,RS,Porto Alegre,51,33285035
EEI HAPPY KIDS,RUA MALI,345,VILA IPIRANGA,91370020,RS,Porto Alegre,51,33779328
5234 EEI JARDIM DE OXUM,AV DR JOAO DENTICE,1045,RESTINGA,91790090,RS,Porto Alegre,51,32487979
ESCOLA DE EDUCACAO INFANTIL BALAO AZUL UNIDADE FILIAL,RUA CASTRO ALVES,711,INDEPENDENCIA,90430131,RS,Porto Alegre,51,34141367
ESCOLA DE ENSINO MEDIO VINICIUS DE MORAIS,AVENIDA MACEDONIA,186,RESTINGA,91790040,RS,Porto Alegre,51,32502329
ESCOLA TECNICA CRISTO REDENTOR,AVENIDA BRASILIANO INDIO DE MORAES,772,PASSO DA AREIA,91030001,RS,Porto Alegre,51,33753000
ESCOLA DE EDUCACAO ESPECIAL DO CENTRO DE REABILITACAO DE PORTO ALEGRE - CEREPAL,RUA BRIGADEIRO OLIVEIRA NERI,100,PASSO DA AREIA,90520260,RS,Porto Alegre,51,33429753
ESC ENS FUND SAO FRANCISCO - SANTA FE,AVENIDA DELMAR ROCHA BARBOSA,234,RUBEM BERTA,91180490,RS,Porto Alegre,51,33669652
5003 EEI ESTRELINHA DO CEU,R ULYSSES DE ALENCASTRO BRANDAO,205,SARANDI,91140400,RS,Porto Alegre,51,33645165
5017 EEI NEGRINHO DO PASTOREIO,R WOLFRAM METZLER,21,RUBEM BERTA,91250320,RS,Porto Alegre,51,33665808
5020 EEI MADRE TERESA,R WOLFRAM METZLER,605,RUBEM BERTA,91250320,RS,Porto Alegre,51,33663177
COLEGIO UNIFICADO INDEPENDENCIA,AVENIDA INDEPENDENCIA,1199,INDEPENDENCIA,90035072,RS,Porto Alegre,51,30921640
5057 EEI CAMPO DA TUCA,RUA D,200,PARTENON,91510480,RS,Porto Alegre,51,33220971
CENTRO EDUCACIONAL BALAO AZUL,RUA CASTRO ALVES,300,INDEPENDENCIA,90430130,RS,Porto Alegre,51,30299801
5120 EEI MEDIANEIRA NOSSO SONHO I,R JARY,119,PASSO DA AREIA,91350170,RS,Porto Alegre,51,32374877
EEI BRINCAR E APRENDER,RUA GARIBALDI,800,INDEPENDENCIA,90035051,RS,Porto Alegre,51,33982686
CENTRO DE ENSINO MEDIO PASTOR DOHMS- UNIDADE DE ENSINO ZONA NORTE,RUA DARIO BORBA BROSSARD,56,RUBEM BERTA,91180480,RS,Porto Alegre,51,33662497
QI ESCOLA DE EDUCACAO PROFISSIONAL ASSIS BRASIL,AVENIDA ASSIS BRASIL,3423,PASSO DA AREIA,91010001,RS,Porto Alegre,51,23130502
EEI GENTE MIUDINHA,RUA MALI,787,VILA IPIRANGA,91370230,RS,Porto Alegre,51,33447069
EEI ARTE E TRAVESSURA,RUA DOUTOR JOAO SIMPLICIO ALVES DE CARVALHO,335,VILA IPIRANGA,91360260,RS,Porto Alegre,51,33415275
GUAIBA CURSOS TECNICOS LTDA,AVENIDA ALBERTO BINS,376,CENTRO HISTORICO,90030140,RS,Porto Alegre,51,32276757
ESCOLA DE EDUCACAO INFANTIL CRIANCA VIDA,RUA JOAO CAETANO,178,TRES FIGUEIRAS,90470260,RS,Porto Alegre,51,30238147
5150 ECEI PE LUIZ PEDROLLO,TRAV COSME E DAMIAO,84,PARTENON,90680247,RS,Porto Alegre,51,9.9832E8
5184 EEI JARDIM IPIRANGA,AV ENG ARY DE ABREU LIMA,390,VILA IPIRANGA,91360070,RS,Porto Alegre,51,33470210
5177 EEI SAO GUILHERME,DIRETRIZ 3729,116,PARTENON,91520650,RS,Porto Alegre,51,33849997
COLEGIO ADVENTISTA NOVO MUNDO,RUA INDIANA,SN,JARDIM NOVO MUNDO,74705300,GO,Goiânia,62,32649000
COLEGIO AGOSTINIANO NS DE FATIMA,RUA 6 A,590,SETOR AEROPORTO,74075220,GO,Goiânia,62,32133022
COLEGIO CLARETIANO CORACAO DE MARIA,AVENIDA PARANAIBA,370,SETOR CENTRAL,74020010,GO,Goiânia,62,32233636
COLEGIO MARISTA GOIANIA EI EF EM,AVENIDA OITENTA E CINCO,1440,SETOR MARISTA,74160010,GO,Goiânia,62,40095875
COLEGIO SANTO AGOSTINHO,RUA 55,63,SETOR CENTRAL,74055150,GO,Goiânia,62,32231326
COLEGIO DELTA I II III,RUA SAO BARTOLOMEU,911,JARDIM PLANALTO,74333260,GO,Goiânia,62,39312020
COLEGIO PREVEST,RUA 5,202,SETOR CENTRAL,74020030,GO,Goiânia,62,32097240
COLEGIO ADVENTISTA JARDIM EUROPA,RUA SANTA EFIGENIA,SN,JARDIM PLANALTO,74333230,GO,Goiânia,62,32649000
ESCOLA SESI PLANALTO,PRACA ITAPUA,150,JARDIM PLANALTO,74843420,GO,Goiânia,62,32362300
INSTITUTO PRESBITERIANO DE EDUCACAO,AVENIDA T 1,1008,SETOR BUENO,74210045,GO,Goiânia,62,32853660
CRECHE SANTA RITA DE CASSIA,RUA 17 A,111,SETOR AEROPORTO,74070100,GO,Goiânia,62,32240888
BERCARIO E MATERNAL SAO COSME E DAMIAO,RUA 32 A,165,SETOR AEROPORTO,74075480,GO,Goiânia,62,32126996
CENTRO DE EDUCACAO INFANTIL DO ABRIGO NOSSO LAR,RUA ANAPOLIS,231,JARDIM NOVO MUNDO,74715040,GO,Goiânia,62,39455294
ESCOLA PRIMEIROS DEGRAUS,RUA IGAPO,45,PARQUE AMAZONIA,74835440,GO,Goiânia,62,32801583
CENTRO EDUCACIONAL BARROZO LTDA -ESTRELINHAS DO FUTURO,RUA CARAGOATA,87,PARQUE AMAZONIA,74840240,GO,Goiânia,62,32481827
ESCOLA MONTEIRO LOBATO,RUA CACAUI QD 10 L4/5,101,PARQUE AMAZONIA,74840230,GO,Goiânia,62,32481276
ESCOLA INFANTIL FAVO DE MEL,RUA MARIA APARECIDA,334,PARQUE AMAZONIA,74843180,GO,Goiânia,62,32808238
ESCOLA O PICA PAU,RUA 9 A,690,SETOR AEROPORTO,74075250,GO,Goiânia,62,32246204
ESCOLA INTELECTUAL,RUA OTAWA,90,JARDIM NOVO MUNDO,74705220,GO,Goiânia,62,32062930
CENTRO DE EDUCACAO INFANTIL PEDACINHO DO CEU,RUA C 99,,SETOR SUDOESTE,74303400,GO,Goiânia,62,32418723
EXPOVEST JUNIOR EDUCACAO PRE-ESCOLAR LTDA,RUA MONTE CASTELO,142,JARDIM PLANALTO,74333200,GO,Goiânia,62,39419051
ESCOLA CANTINHO FELIZ LTDA ME,RUA C 40,217,SETOR SUDOESTE,74305210,GO,Goiânia,62,32879264
COLEGIO EXPOVEST,RUA AMELIO,110,JARDIM PLANALTO,74333150,GO,Goiânia,62,32879050
SENAC - CENTRO DE EDUCACAO PROFISSIONAL ELIAS BUFAICAL,RUA 31 A,43,SETOR AEROPORTO,74075470,GO,Goiânia,62,32195160
COLEGIO DEGRAUS,RUA C 97,309,SETOR SUDOESTE,74303380,GO,Goiânia,62,32870466
CENTRO EDUC SESC CIDADANIA ELIAS BUFAICAL NETO,AVENIDA C 197,812,JARDIM AMERICA,74270030,GO,Goiânia,62,32508000
COLEGIO APOIO,RUA MANAGUA,672,JARDIM NOVO MUNDO,74705200,GO,Goiânia,62,35658020
COLEGIO FRACTAL CIDADE JARDIM,RUA FORMOSA,1197,CIDADE JARDIM,74425410,GO,Goiânia,62,39267209
COLEGIO WRJ,AV ANTONIO FIDELIS,1874,PARQUE AMAZONIA,74840390,GO,Goiânia,62,39974950
COLEGIO PRINCIPIOS,RUA C 67,65,SETOR SUDOESTE,74305460,GO,Goiânia,62,32470303
ESCOLA ATOS,RUA DIVINO OLIVEIRA,178,CIDADE JARDIM,74425220,GO,Goiânia,62,35950909
ESCOLA INFANTIL RECREIO EIRELI,RUA MOSSORO,322,JARDIM NOVO MUNDO,74715340,GO,Goiânia,62,32842960
COLEGIO INTEGRADO UNIDADE AREIAO,RUA 1139,323,SETOR MARISTA,74180180,GO,Goiânia,62,36382400
ESCOLA RODA VIVA,AV PIRATININGA,440,PARQUE AMAZONIA,74835160,GO,Goiânia,62,35150021
COLEGIO INTELECTUAL INTEGRAL LTDA,RUA VINHA DEL MAR,,JARDIM NOVO MUNDO,74705160,GO,Goiânia,62,32062930
ESPACO INFANTIL ARTE E CIDADANIA,25 A,,SETOR AEROPORTO,74070150,GO,Goiânia,.,.
COLEGIO UNUS KIDS,RUA CANUMA,30,PARQUE AMAZONIA,74840540,GO,Goiânia,62,32483643
BERCARIO E ESCOLA SAGRADA FAMILIA,AVENIDA C 18,304,SETOR SUDOESTE,74303030,GO,Goiânia,62,41041177
COLEGIO META BURITI,AVENIDA RIO NEGRO,,PARQUE AMAZONIA,74840520,GO,Goiânia,62,32800671
ESCOLA ZARA,RUA 1141,455,SETOR MARISTA,74180081,GO,Goiânia,62,39233434
COLEGIO SAGRADA FAMILIA LTDA,AVENIDA DONA TEREZINHA DE MORAIS,600,PARQUE AMAZONIA,74843150,GO,Goiânia,62,34345626
ESCOLA INOVADORA ARARUNA ANARE,RUA COLONIA,2563,JARDIM NOVO MUNDO,74705040,GO,Goiânia,62,9.9955E8
ESCOLA INFANTIL RECREIO,RUA MOSSORO,,JARDIM NOVO MUNDO,74715340,GO,Goiânia,62,35423807
FRACTAL CENTRO DE EDUCACAO E ENSINO,AVENIDA T 9 COM RUA U-42,4586,JARDIM PLANALTO,74333010,GO,Goiânia,62,39427230
COL LA SALLE BRASILIA,QUADRA SGAS 906 CONJUNTO E,,ASA SUL,70390060,DF,Brasília,61,34437878
C EDUCACIONAL LEONARDO DA VINCI,QUADRA SEPS 703/903,,ASA SUL,70390039,DF,Brasília,61,32266703
C EDUCACIONAL LEONARDO DA VINCI - UNID NORTE,QUADRA SGAN 914,0,ASA NORTE,70790140,DF,Brasília,61,33401616
C EDUCACIONAL SAGRADA FAMILIA,QUADRA SGAN 906,,ASA NORTE,70790060,DF,Brasília,61,32721727
C EDUCACIONAL SIGMA,SGAS QUADRA,912,ASA SUL,70310500,DF,Brasília,61,37011109
COL MADRE CARMEN SALLES,SGAN 604 MODULO D,,ASA NORTE,70830154,DF,Brasília,61,32232863
COL SAGRADO CORACAO DE MARIA,QUADRA SGAN 702 CONJUNTO C,,ASA NORTE,70710750,DF,Brasília,61,30315000
COL SANTA DOROTEIA,QUADRA SGAN 911,,ASA NORTE,70790110,DF,Brasília,61,32745110
C EDUCACIONAL ADVENTISTA MILTON AFONSO,QUADRA SGAS 611 MODULO,75,ASA SUL,70200710,DF,Brasília,61,34415000
CE BRASIL CENTRAL,QUADRA QNE 24,06/10,TAGUATINGA NORTE TAGUATINGA,72125240,DF,Brasília,61,33540046
CE DO SESI-DF - TAGUATINGA,QUADRA QNF 24,,TAGUATINGA NORTE TAGUATINGA,72125740,DF,Brasília,61,33559547
C EDUCACIONAL CATOLICA DE BRASILIA,QUADRA QS 07,LOTE 01,AGUAS CLARAS,71966700,DF,Brasília,61,34515022
COL MARISTA CHAMPAGNAT,AREA ESPECIAL QSD AREA ESPECIAL,01,TAGUATINGA SUL TAGUATINGA,72015597,DF,Brasília,61,21911511
COL JESUS MARIA JOSE,QNG 40 AREA ESPECIAL 5B,,TAGUATINGA NORTE,72130003,DF,Brasília,61,33542444
C EDUCACIONAL PROJECAO TAGUATINGA NORTE,"SETOR C NORTE, AREA ESPECIAL 5/6 E SETOR B NORTE, AREA ESPECIAL 5",,TAGUATINGA NORTE,72115700,DF,Brasília,61,34513888
CED ADVENTISTA DE TAGUATINGA,QSB 4,07,TAGUATINGA SUL TAGUATINGA,72015540,DF,Brasília,61,34415000
INST DE EDUC GUINESS,QUADRA QSA 7,15/21 E 22,TAGUATINGA SUL TAGUATINGA,72015070,DF,Brasília,61,35627450
CED PROJECAO TAGUATINGA NORTE UNIDADE II,QUADRA QNJ 17,,TAGUATINGA NORTE TAGUATINGA,72140170,DF,Brasília,61,34752277
C DE ENS SANTA RITA DE CASSIA,QUADRA QUADRA 9 LOTE ESPECIAL E AREA RESERVADA,02,SOBRADINHO,73035090,DF,Brasília,61,35914241
COL LA SALLE - SOBRADINHO,QUADRA QUADRA 14,24/27,SOBRADINHO,73050140,DF,Brasília,61,33878840
COL APROVACAO PHD,QUADRA QUADRA 13,,SOBRADINHO,73040130,DF,Brasília,61,35911801
INST EDUCACIONAL SANTO ELIAS,QUADRA QUADRA 11,,SOBRADINHO,73040110,DF,Brasília,61,34539650
INST SAO JOSE,QUADRA 4 AREA ESPECIAL,01,SOBRADINHO,73025040,DF,Brasília,61,34875258
REDE DE ENS CERTO - UNIDADE CEILANDIA,QUADRA EQNP 9/13 MODULO A,,CEILANDIA NORTE CEILANDIA,72240571,DF,Brasília,61,35854151
ESC DE EDUC BASICA E PROFISSIONAL FUNDACAO BRADESCO,QUADRA QNN 28,SEM NUMERO,CEILANDIA SUL CEILANDIA,72220280,DF,Brasília,61,34712219
INST SOUSA ARANTES,QUADRA EQNP 30/34 MODULO F,SN,CEILANDIA SUL CEILANDIA,72236516,DF,Brasília,61,33762344
